{"accounting":{"aggregate_result":"passed","runs":[{"duration_seconds":3.625,"result":"passed","suites":71,"tests":550},{"duration_seconds":0.934,"result":"passed","suites":5,"tests":41}],"suites":76,"total":591},"artifact_kind":"validation","created_at_utc":"2026-06-20T06:30:32Z","disposition_authority":"none — raw-fact producer output; not a gatekeeper disposition","host":{"os":"Darwin mm4.local 27.0.0 Darwin Kernel Version 27.0.0: Wed May 27 02:11:37 PDT 2026; root:xnu-13361.0.0.501.1~2/RELEASE_ARM64_T8132 arm64","sw_vers":"27.0"},"inputs":[{"path":"artifacts/explorer-mx-a64z/block-018/swift-testing-run/swift-testing.raw.log","sha256":"51693f923db89e66d7c3f05273b540a2c89fdb5fcae568f5ba589913d564129b"}],"mode":"explorer","raw_digest":{"raw_log_sha256":"51693f923db89e66d7c3f05273b540a2c89fdb5fcae568f5ba589913d564129b"},"repo":{"dirty":true,"head":"fe90b2e615eead6dcd56462905e8c824767dd970","path":"/Users/linz/Local/swift-rx/swift-rx-explorer"},"run":{"accounting_present":true,"attempt_consumed":true,"complete_pass_set_proven":true,"id":"block-018-swift-testing-mx-a64z","return_code":0},"schema":"swift-testing-run.v1","source":{"path":"/tmp/swift-r64z-work/swift-testing","pin":"4b2d2945d2072a547f9004066f832b7fd10a00d6"},"status_counts_observed":{"failed":0,"passed":587,"skipped":4,"suites_failed":0,"suites_passed":76,"unique_passed":579},"status_observation":{"accounted_suite_total":76,"accounted_test_total":591,"aggregate_passed":true,"complete_pass_set_proven":true,"no_failures_observed":true,"observed_suite_total":76,"observed_test_total":591,"result_consistent":true,"suite_counts_match_accounting":true,"test_counts_match_accounting":true},"suites":{"failed":[],"passed":["ABI entry point tests","ABI.EncodedEventTests","ABI.EncodedTestTests","Advanced Console Output Recorder Tests","Atomic tests","Attachment Tests","AttachmentSavingTrait tests","Backtrace Tests","Bug Tests","Built-in conformances","CError Tests","CapturableSuite","Cartesian Product Tests","Clock API Tests","Comment Tests","Condition Trait Tests","ConditionMacro Tests","Configuration Tests","Confirmation Tests","Containing suite types without @Suite are synthesized","CustomTestReflectable Tests","CustomTestStringConvertible Tests","Entry point tests","Environment Tests","Event Tests","EventHandlingInteropTests","EventRecorderTests","ExecutionControl","Exit test tests","Expression.Value Tests","FileHandle Tests","FoundationTests","Graph<K, V> Tests","Hidden Trait Tests","Image tests","Issue Codable Conformance Tests","IssueHandlingTrait Tests","Miscellaneous tests","Mutex tests","Non-Copyable/Non-Escapable Tests","NonXCTestCaseClassTests","Objective-C/XCTest Interop Tests","Parallelization Trait Tests","Parallelization Trait Tests with Dependencies","PragmaMacro Tests","Runner.Plan Tests","Runner.Plan-dumping Tests","Runner.Plan.Snapshot tests","Runner.RuntimeState Tests","Runtime Test Discovery Tests","SHA256Tests","Shows as skipped in Xcode 16","SkipInfo Tests","SourceLocation Tests","Swift Package Manager Integration Tests","Tag/Tag List Tests","TagMacro Tests","Test cancellation tests","Test.Case Selection Tests","Test.Case Tests","Test.Case.Argument Tests","Test.Case.Argument.ID Tests","Test.Case.Generator Tests","Test.Case.ID Tests","Test.ID.Selection Tests","Test.Snapshot tests","TestCaseIterationTests","TestDeclarationMacro Tests","TestScoping-conforming Trait Tests","TestingAdditionsTests","TimeLimitTrait Tests","Type Name Conflict Tests","TypeInfo Tests","Unique Identifier Tests","Unit tests for interop mode selection","zip Tests"]},"tests":{"expectedly_failed":[],"failed":[],"hung":[],"passed":["#_sourceLocation and #Testing::sourceLocation are equivalent","#expect() macro","#expect(false) and #require(false) warn they always fail","#expect(processExitsWith:) diagnostics","#expect(processExitsWith:) produces a diagnostic for a bad capture","#expect(true) and #require(true) note they always pass","#require() macro","#require(Bool?) produces a diagnostic","#require(as Bool?) suppresses its diagnostic","#require(non-optional value) produces a diagnostic\" with 1 test case","#require(optional value mistyped as non-optional) diagnostic is suppressed","#require(throws: Never.self) produces a diagnostic","--configuration-path argument","--event-stream-output-path argument (writes to a stream and can be read back)","--experimental-maximum-parallelization-width argument","--filter argument","--filter or --skip argument as last argument","--filter or --skip argument with bad regex","--filter suppresses console output when no tests found","--filter with no matches","--filter/--skip arguments and .hidden trait","--foo=bar form","--parallel/--no-parallel argument","--repeat-until argument with garbage value (alone)","--repeat-until fail argument (alone)","--repeat-until pass argument (alone)","--repetitions and --repeat-until arguments","--repetitions argument (alone)","--skip argument","--skip suppresses console output when no tests found","--symbolicate-backtraces argument","--verbose, --very-verbose, and --quiet arguments","--verbosity argument","--xunit-output argument (bad path)","--xunit-output argument (missing path)","--xunit-output argument (writes to file)",".bug() is not recursively applied",".bug() with SignedInteger",".bug() with String",".bug() with URL string",".bug() with UnsignedInteger",".comment() factory method",".disabled if trait",".disabled trait",".enabled if trait",".enabled trait",".hidden trait",".serialized trait serializes parameterized test",".tags() factory method with colors",".tags() factory method with one tag",".tags() factory method with two tags",".timeLimit() factory method","/dev/null is not a TTY or pipe","@Tag macro","A test function in a type hierarchy where the nearest suite is explicit and outer ones are implicit","A test function in a type hierarchy with all implicit suites","A test function in a type hierarchy with both explicit and implicit suites","A test function inside a top-level implicit suite","Accessing the current Test and Test.Case from an issue handler closure","All elements of two ranges are equal","An API misused issue can be returned by issue handler closure when the original issue had that kind","An unthrown error has no backtrace","Argument types influence generated identifiers","Arguments to the macro are not captured during expansion (do not need to be literals/const)","Attach Codable- and NSSecureCoding-conformant values","Attach NSSecureCoding-conformant value but with a JSON type","Attach NSSecureCoding-conformant value but with a nonsensical type","Attach Transferable-conformant value","Attach Transferable-conformant value with a nonsensical type","Attach Transferable-conformant value with no available type","Availability attributes are captured","Backtrace.current() is populated","Basic event recording produces output","Body does not influence generated identifiers","Bool(false) suppresses the warning about always failing","Bug hashing","CError.description property","Can close ends of a pipe","Can extract the ABI version from record JSON","Can get a custom mirror from a value","Can get file descriptor","Can get stderr","Can get stdout","Can read from a file","Can recognize opened TTY","Can recognize opened pipe","Can write to a file","Cancelled tests can exit early (cancellation checking works)","Cancelling a test","Cancelling a test by cancelling its task (returning)","Cancelling a test by cancelling its task (throwing)","Cancelling a test case in a parameterized test","Cancelling a test propagates its SkipInfo to its test cases","Cancelling a test while evaluating test cases skips the test","Cancelling a test while evaluating traits skips the test","Cancelling the current task in an exit test doesn't cancel the test","Cancelling the current task while evaluating test cases skips the test","Cancelling the current task while evaluating traits skips the test","Cancelling the current test from within an exit test","Cannot write bytes to a read-only file","Cannot write string to a read-only file","Capture list","Capture list (very long encoded form)","Capturing #_sourceLocation","Capturing a literal expression","Capturing a parameter to the test function","Capturing an effectful expression","Capturing an instance of a subclass","Capturing an optional value","Capturing comments above #expect()/#require()","Cartesian product with empty first input is empty","Cartesian product with empty second input is empty","Cartesian products compare equal","CartesianProduct.underestimatedCount is clamped at .max","Casting Test.Clock.Instant to Date","Clock.Instant basics","Clock.Instant.advanced(by:) and .duration(to:) methods","Clock.Instant.durationSince1970 property","Clock.minimumResolution property","Clock.now property","Clock.sleep(until:tolerance:) method","Codable","Colors are read from disk","Combining test filter by ID with .unfiltered (lhs)","Combining test filter by ID with .unfiltered (rhs)","Combining test filter by ID with by tag","Combining test filters with .or","Command line arguments are available","Comparing Bug instances","Complete interop mode uses error severity","Concurrent access (summing ten times) is consistent","Configuration.defaultTestTimeLimit property","Configuration.defaultTestTimeLimit property set higher than maximum","Configuration.maximumTestTimeLimit property","Confirmation requires positive count","Count of cartesian product","Creating a SuspendingClock.Instant from Test.Clock.Instant","Custom descriptions are the same","Custom execution trait throws an error","Custom source location argument to #expect()","Decode from event","Decode issueRecorded","Decode suite components","Decode test components","Decode valueAttached","Decoded event always has nil testID and testCaseID","Decoding an encoded attachment from an event","Decoding an encoded attachment with an error (experimental)","Decoding an encoded attachment with bytes (experimental)","Decoding an encode